[
  { "id": "core.sprite.building.bed", "kind": "sprite", "size": 16, "palette": {"k": "#1b1f24", "m": "$main", "M": "$main-", "w": "#eeeeee", "W": "#c9c4ba", "c": "#4f7cac", "C": "#b8423a"},
    "rows": [
      ".kkkkkkkkkkkkkk.",
      ".kMMMMMMMMMMMMk.",
      ".kMwwwwwwwwwwMk.",
      ".kMwWWWWWWWWwMk.",
      ".kMwwwwwwwwwwMk.",
      ".kMkkkkkkkkkkMk.",
      ".kMccccccccccMk.",
      ".kMccccccccccMk.",
      ".kMccCccccCccMk.",
      ".kMccccccccccMk.",
      ".kMccCccccCccMk.",
      ".kMccccccccccMk.",
      ".kMccccccccccMk.",
      ".kMMMMMMMMMMMMk.",
      ".kmk........kmk.",
      ".kkk........kkk."
    ] },
  { "id": "core.sprite.building.campfire", "kind": "sprite", "size": 16, "palette": {"k": "#1b1f24", "o": "#e8662a", "y": "#ffd25a", "g": "#4a4440", "G": "#2a2522", "b": "#5a3d22"},
    "rows": [
      "................",
      "................",
      ".......y........",
      "......yoy.......",
      ".....yoooy..y...",
      "....yoooyoy.oy..",
      "....ooyyyoo.o...",
      "...koooyyyoook..",
      "..kbbooyyoobbbk.",
      "..kgbbbbbbbbbgk.",
      ".kgggbbkkbbgggk.",
      ".kGgggggggggggGk",
      "..kGGgggggggGGk.",
      "...kkkkkkkkkkk..",
      "................",
      "................"
    ] },
  { "id": "core.sprite.building.tailor_bench", "kind": "sprite", "size": 16, "palette": {"k": "#1b1f24", "m": "$main", "M": "$main-", "l": "$main+", "c": "#4f7cac", "C": "#b8423a", "s": "#c9ced6"},
    "rows": [
      "................",
      "................",
      ".kkkkkkkkkkkkkk.",
      ".kllllllllllllk.",
      ".klcccccclllllk.",
      ".klcccccclsslsk.",
      ".klCCCCCClkslsk.",
      ".klllllllllsllk.",
      ".kmmmmmmmmmmmmk.",
      ".kMMMMMMMMMMMMk.",
      ".kMk........kMk.",
      ".kMk........kMk.",
      ".kMk........kMk.",
      ".kkk........kkk.",
      "................",
      "................"
    ] },
  { "id": "core.sprite.building.fireplace", "kind": "sprite", "size": 16, "palette": {"k": "#1b1f24", "m": "$main", "M": "$main-", "l": "$main+", "o": "#e8662a", "y": "#ffd25a", "G": "#2a2522", "b": "#5a3d22"},
    "rows": [
      ".kkkkkkkkkkkkkk.",
      ".kllllllllllllk.",
      ".kmmmmmmmmmmmmk.",
      ".kmMMMMMMMMMMmk.",
      ".kmkGGGGGGGGkmk.",
      ".kmkGGGGGGGGkmk.",
      ".kmkGGGyGGGGkmk.",
      ".kmkGGyoyGGGkmk.",
      ".kmkGyoooyGGkmk.",
      ".kmkGoyyyoGGkmk.",
      ".kmkbobbobbGkmk.",
      ".kmkbbbbbbbbkmk.",
      ".kmMMMMMMMMMMmk.",
      ".kMMMMMMMMMMMMk.",
      ".kkkkkkkkkkkkkk.",
      "................"
    ] },
  { "id": "core.sprite.building.cooler", "kind": "sprite", "size": 16, "palette": {"k": "#1b1f24", "m": "$main", "M": "$main-", "l": "$main+"},
    "rows": [
      "................",
      ".kkkkkkkkkkkkkk.",
      ".kllllllllllllk.",
      ".kmMMMMMMMMMMmk.",
      ".kmkkkkkkkkkkmk.",
      ".kmMMMMMMMMMMmk.",
      ".kmkkkkkkkkkkmk.",
      ".kmMMMMMMMMMMmk.",
      ".kmkkkkkkkkkkmk.",
      ".kmMMMMMMMMMMmk.",
      ".kmkkkkkkkkkkmk.",
      ".kmMMMMMMMMMMmk.",
      ".kMMMMMMMMMMMMk.",
      ".kkkkkkkkkkkkkk.",
      "................",
      "................"
    ] },
  { "id": "core.sprite.building.door", "kind": "sprite", "size": 16, "palette": {"k": "#1b1f24", "m": "$main", "M": "$main-", "l": "$main+", "y": "#ffd25a"},
    "rows": [
      "kkkkkkkkkkkkkkkk",
      "kMMMMMMMMMMMMMMk",
      "kMkkkkkkkkkkkkMk",
      "kMkmmmmmkmmmmkMk",
      "kMkmlmmmkmlmmkMk",
      "kMkmlmmmkmlmmkMk",
      "kMkmmmmmkmmmmkMk",
      "kMkmmmmmkmmmyyMk",
      "kMkmmmmmkmmmyyMk",
      "kMkmmmmmkmmmmkMk",
      "kMkmlmmmkmlmmkMk",
      "kMkmlmmmkmlmmkMk",
      "kMkmmmmmkmmmmkMk",
      "kMkkkkkkkkkkkkMk",
      "kMMMMMMMMMMMMMMk",
      "kkkkkkkkkkkkkkkk"
    ] }
]
