[
  {
    "id": "flax.sprite.plant.flax",
    "kind": "sprite",
    "size": 16,
    "palette": {"g": "$main", "b": "#6f8fd8", "B": "#b9cdf5"},
    "rows": [
      "................",
      "...b.....b......",
      "..bBb...bBb..b..",
      "...g..b..g..bBb.",
      "...g.bBb.g...g..",
      "..gg..g..gg..g..",
      "...g..g...g.gg..",
      "..g.g.g..g..g...",
      "...g.gg.g...g.g.",
      "..gg..g.g..gg...",
      "...g..gg...g....",
      "..g...g...g.g...",
      "...g..g..g..g...",
      "................",
      "................",
      "................"
    ]
  },
  {
    "id": "flax.sprite.item.linen",
    "kind": "sprite",
    "size": 16,
    "palette": {"k": "#1b1f24", "m": "$main", "M": "$main-", "l": "$main+"},
    "rows": [
      "................",
      "................",
      "................",
      "................",
      "...kkkkkkkkkk...",
      "..kllllllllllk..",
      ".kmlmmmmmmmmmMk.",
      ".kMlMMMMMMMMMMk.",
      ".kmlmmmmmmmmmMk.",
      "..kMMMMMMMMMMk..",
      "...kkkkkkkkkk...",
      "................",
      "................",
      "................",
      "................",
      "................"
    ]
  }
]
