[
  { "id": "core.sprite.animal.small", "kind": "sprite", "size": 16, "palette": {"k": "#1b1f24", "m": "$main", "M": "$main-", "e": "#1b1f24", "t": "#e8e2d0"},
    "rows": [
      "................",
      "................",
      "................",
      "...........kk...",
      "..........kmk...",
      "..........kmk...",
      ".....kkkk.kmk...",
      "....kmmmmkmmkk..",
      "...kmmmmmmmmek..",
      "..kmmmmmmmmmmMk.",
      "..kmmmmmmmmmMk..",
      "..ktmmmmmmmMk...",
      "...kMMkkkkMMk...",
      "...kk.....kk....",
      "................",
      "................"
    ] },
  { "id": "core.sprite.animal.deer", "kind": "sprite", "size": 16, "palette": {"k": "#1b1f24", "m": "$main", "M": "$main-", "e": "#1b1f24", "t": "#e8e2d0"},
    "rows": [
      "..........k..k..",
      "..........kk.k..",
      "...........kkk..",
      "...........kmmk.",
      "..........kmmemk",
      "..........kmmkk.",
      "..........kmk...",
      "...kkkkkkkmmk...",
      "..kmmmmmmmmmk...",
      ".kmmmmmmmmmmk...",
      ".kmmmmmmmmmMk...",
      ".ktmmmmmmmMMk...",
      "..kMk....kMk....",
      "..kMk....kMk....",
      "..kMk....kMk....",
      "..kkk....kkk...."
    ] },
  { "id": "core.sprite.animal.boar", "kind": "sprite", "size": 16, "palette": {"k": "#1b1f24", "m": "$main", "M": "$main-", "w": "#f4f1e8", "e": "#1b1f24"},
    "rows": [
      "................",
      "................",
      "................",
      "................",
      "................",
      "................",
      "....kkkkkkk.....",
      "...kmmmmmmmkk...",
      "..kmMmMmmmmmmk..",
      ".kmmmmmmmmmmemk.",
      ".kmmmmmmmmmmmmwk",
      ".kmmmmmmmmmmmMk.",
      "..kMMmmmmmmMMk..",
      "..kMk.kkkk.kMk..",
      "..kMk......kMk..",
      "..kkk......kkk.."
    ] },
  { "id": "core.sprite.animal.canine", "kind": "sprite", "size": 16, "palette": {"k": "#1b1f24", "m": "$main", "M": "$main-", "e": "#1b1f24", "t": "#e8e2d0"},
    "rows": [
      "................",
      "................",
      "................",
      "...........k.k..",
      "..........kmkmk.",
      "..........kmmmk.",
      ".k........kmemkk",
      "km.......kmmmmMk",
      ".km.kkkkkmmmkkk.",
      "..kmmmmmmmmmk...",
      "..kmmmmmmmmmk...",
      "..kmmmmmmmmMk...",
      "..ktmmmmmmMMk...",
      "..kMk....kMk....",
      "..kMk....kMk....",
      "..kkk....kkk...."
    ] },
  { "id": "core.sprite.animal.feline", "kind": "sprite", "size": 16, "palette": {"k": "#1b1f24", "m": "$main", "M": "$main-", "e": "#1b1f24"},
    "rows": [
      "................",
      "................",
      "................",
      "................",
      "................",
      "...........k.k..",
      "..........kmkmk.",
      "..........kmmmk.",
      "k.........kmemk.",
      "km..kkkkkkmmmMk.",
      ".kmkmmmmmmmmkk..",
      "..kmmmmmmmmmk...",
      "..kmmmmmmmmMk...",
      "..kMk.....kMk...",
      "..kMk.....kMk...",
      "..kkk.....kkk..."
    ] },
  { "id": "core.sprite.animal.bear", "kind": "sprite", "size": 16, "palette": {"k": "#1b1f24", "m": "$main", "M": "$main-", "e": "#1b1f24"},
    "rows": [
      "................",
      "................",
      "................",
      "................",
      "..........kk.kk.",
      ".....kkkkkkmkkmk",
      "....kmmmmmmmmmmk",
      "...kmmmmmmmmmemk",
      "..kmmmmmmmmmmmMk",
      "..kmmmmmmmmmmmkk",
      "..kmmmmmmmmmmMk.",
      "..kmmmmmmmmmMMk.",
      "..kMMmmmmmmMMk..",
      "..kMMk...kMMk...",
      "..kMMk...kMMk...",
      "..kkkk...kkkk..."
    ] }
]
