[
  {
    "id": "furhats.sprite.item.fur_hat",
    "kind": "sprite",
    "size": 16,
    "palette": {"k": "#1b1f24", "m": "$main", "M": "$main-", "l": "$main+", "w": "#e9e2d0", "W": "#c2b79c"},
    "rows": [
      "................",
      "................",
      "................",
      "................",
      "......kkkk......",
      "....kkmmmmkk....",
      "...kmlmmmmmmk...",
      "...kmmmmmmmMk...",
      "..kwwwwwwwwwwk..",
      "..kwWwwWwwWwwk..",
      "..kwwk....kwwk..",
      "..kwWk....kwWk..",
      "...kk......kk...",
      "................",
      "................",
      "................"
    ]
  },
  {
    "id": "furhats.sprite.wear.fur_hat",
    "kind": "sprite",
    "size": 16,
    "palette": {"k": "#1b1f24", "m": "$main", "M": "$main-", "l": "$main+", "w": "#e9e2d0", "W": "#c2b79c"},
    "rows": [
      "......kkkk......",
      "....kkmmmmkk....",
      "...kmlmmmmmMk...",
      "..kwwwwwwwwwwk..",
      "..kwk......kwk..",
      "..kwk......kwk..",
      "...k........k...",
      "................",
      "................",
      "................",
      "................",
      "................",
      "................",
      "................",
      "................",
      "................"
    ]
  },
  {
    "id": "furhats.sprite.portrait.fur_hat",
    "kind": "sprite",
    "size": 32,
    "palette": {"k": "#1b1f24", "m": "$main", "M": "$main-", "l": "$main+", "w": "#e9e2d0", "W": "#c2b79c"},
    "rows": [
      "................................",
      "................................",
      "............kkkkkkkk............",
      "..........kkmmmmmmmmkk..........",
      ".........kmmlmmmmmmmmmk.........",
      "........kmmllmmmmmmmmmmk........",
      "........kmlmmmmmmmmmmmMk........",
      "........kmmmmmmmmmmmmmMk........",
      ".......kwwwwwwwwwwwwwwwwk.......",
      "......kwwWwwwWwwwWwwwWwwwk......",
      "......kwwwwwwwwwwwwwwwwwwk......",
      "......kwWwk..........kwWwk......",
      "......kwwwk..........kwwwk......",
      "......kwWwk..........kwWwk......",
      "......kwwwk..........kwwwk......",
      ".......kkk............kkk.......",
      "................................",
      "................................",
      "................................",
      "................................",
      "................................",
      "................................",
      "................................",
      "................................",
      "................................",
      "................................",
      "................................",
      "................................",
      "................................",
      "................................",
      "................................",
      "................................"
    ]
  }
]
