[
  { "id": "core.sprite.item.tunic", "kind": "sprite", "size": 16, "palette": {"k": "#1b1f24", "m": "$main", "M": "$main-"},
    "rows": [
      "................",
      "................",
      "....kkk..kkk....",
      "...kmmmkkmmmk...",
      "..kmmmmMMmmmmk..",
      "..kmmmmmmmmmmk..",
      "..kkkmmmmmmkkk..",
      "....kmmmmmmk....",
      "....kmmmmmmk....",
      "....kmmmmmmk....",
      "....kmmmmmmk....",
      "....kMMMMMMk....",
      "....kkkkkkkk....",
      "................",
      "................",
      "................"
    ] },
  { "id": "core.sprite.item.trousers", "kind": "sprite", "size": 16, "palette": {"k": "#1b1f24", "m": "$main", "M": "$main-"},
    "rows": [
      "................",
      "................",
      "....kkkkkkkk....",
      "....kMMMMMMk....",
      "....kmmmmmmk....",
      "....kmmmmmmk....",
      "....kmmmkmmk....",
      "....kmmk.kmmk...",
      "...kmmk..kmmk...",
      "...kmmk..kmmk...",
      "...kmmk..kmmk...",
      "...kMMk..kMMk...",
      "...kkkk..kkkk...",
      "................",
      "................",
      "................"
    ] },
  { "id": "core.sprite.item.tuque", "kind": "sprite", "size": 16, "palette": {"k": "#1b1f24", "m": "$main", "M": "$main-", "l": "$main+"},
    "rows": [
      "................",
      "................",
      "................",
      ".......ll.......",
      "......kllk......",
      ".....kmmmmk.....",
      "....kmmmmmmk....",
      "....kmmmmmmk....",
      "...kmmmmmmmmk...",
      "...kMMMMMMMMk...",
      "...kMMMMMMMMk...",
      "...kkkkkkkkkk...",
      "................",
      "................",
      "................",
      "................"
    ] },
  { "id": "core.sprite.item.sun_hat", "kind": "sprite", "size": 16, "palette": {"k": "#1b1f24", "m": "$main", "M": "$main-", "y": "#d8b04a"},
    "rows": [
      "................",
      "................",
      "................",
      "................",
      "......kkkk......",
      ".....kmmmmk.....",
      ".....kmmmmk.....",
      ".....kyyyyk.....",
      ".kkkkMMMMMMkkkk.",
      ".kmmmmmmmmmmmmk.",
      "..kkkkkkkkkkkk..",
      "................",
      "................",
      "................",
      "................",
      "................"
    ] },
  { "id": "core.sprite.item.parka", "kind": "sprite", "size": 16, "palette": {"k": "#1b1f24", "m": "$main", "M": "$main-", "w": "#efe9dc"},
    "rows": [
      "................",
      "...kwwwwwwwwk...",
      "..kmmmmwwmmmmk..",
      ".kmmmmmMMmmmmmk.",
      ".kmmmmmMMmmmmmk.",
      ".kmmmkmMMmkmmmk.",
      ".kmmmkmMMmkmmmk.",
      ".kmmmkmMMmkmmmk.",
      ".kwwkkmMMmkkwwk.",
      "..kk.kmMMmk.kk..",
      ".....kmMMmk.....",
      ".....kwwwwk.....",
      ".....kkkkkk.....",
      "................",
      "................",
      "................"
    ] },
  { "id": "core.sprite.item.leather_vest", "kind": "sprite", "size": 16, "palette": {"k": "#1b1f24", "m": "$main", "M": "$main-"},
    "rows": [
      "................",
      "................",
      "....kkk..kkk....",
      "...kmmk..kmmk...",
      "...kmmk..kmmk...",
      "..kmmmMk.kMmmk..",
      "..kmmmmk.kmmmk..",
      "..kmmmMk.kMmmk..",
      "..kmmmmk.kmmmk..",
      "..kmmmMk.kMmmk..",
      "..kMMMMk.kMMMk..",
      "..kkkkkk.kkkkk..",
      "................",
      "................",
      "................",
      "................"
    ] },
  { "id": "core.sprite.item.wood", "kind": "sprite", "size": 16, "palette": {"k": "#1b1f24", "m": "$main", "M": "$main-", "l": "$main+", "t": "#e8e2d0"},
    "rows": [
      "................",
      "................",
      "................",
      "................",
      "..kkkkkkkkkkk...",
      ".kmmmmmmmmmmlk..",
      ".kMMMMMMMMMMtk..",
      "..kkkkkkkkkkkk..",
      ".kkkkkkkkkkk....",
      "kmmmmmmmmmmlk...",
      "kMMMMMMMMMMtk...",
      ".kkkkkkkkkkk....",
      "................",
      "................",
      "................",
      "................"
    ] },
  { "id": "core.sprite.item.stone", "kind": "sprite", "size": 16, "palette": {"k": "#1b1f24", "m": "$main", "M": "$main-", "l": "$main+"},
    "rows": [
      "................",
      "................",
      "................",
      ".....kkkkkk.....",
      ".....kllllk.....",
      ".....kmmmmk.....",
      "..kkkkkkkkkkkk..",
      "..kllllkkllllk..",
      "..kmmmmkkmmmmk..",
      "..kMMMMkkMMMMk..",
      "..kkkkkkkkkkkk..",
      "................",
      "................",
      "................",
      "................",
      "................"
    ] },
  { "id": "core.sprite.item.steel", "kind": "sprite", "size": 16, "palette": {"k": "#1b1f24", "m": "$main", "M": "$main-", "l": "$main+"},
    "rows": [
      "................",
      "................",
      "................",
      "................",
      "......kkkkkkkk..",
      ".....kllllllk...",
      "....kmmmmmmMk...",
      "...kkkkkkkkk....",
      "..kkkkkkkk......",
      ".kllllllk.......",
      "kmmmmmmMk.......",
      "kkkkkkkk........",
      "................",
      "................",
      "................",
      "................"
    ] },
  { "id": "core.sprite.item.berries", "kind": "sprite", "size": 16, "palette": {"k": "#1b1f24", "m": "$main", "M": "$main-", "l": "$main+"},
    "rows": [
      "................",
      "................",
      "................",
      "........kk......",
      ".......kM.......",
      ".....kkkkkk.....",
      "....kmmklmmk....",
      "...kmlmkmmmMk...",
      "...kmmmkmmlMk...",
      "...kkkkkkkkkk...",
      "....kmlmkmlmk...",
      "....kMMMkMMMk...",
      ".....kkk.kkk....",
      "................",
      "................",
      "................"
    ] },
  { "id": "core.sprite.item.rice", "kind": "sprite", "size": 16, "palette": {"k": "#1b1f24", "m": "$main", "w": "#efe9dc", "W": "#cfc6b3"},
    "rows": [
      "................",
      "................",
      ".......kk.......",
      "......kWWk......",
      ".....kwwwwk.....",
      "....kwwwwwwk....",
      "...kwwwwwwwwk...",
      "...kwwwwwwwwk...",
      "...kWwwwwwwWk...",
      "...kkkkkkkkkk...",
      "....kmmmmmmk....",
      "....kkkkkkkk....",
      "................",
      "................",
      "................",
      "................"
    ] },
  { "id": "core.sprite.item.potato", "kind": "sprite", "size": 16, "palette": {"k": "#1b1f24", "m": "$main", "M": "$main-", "l": "$main+"},
    "rows": [
      "................",
      "................",
      "................",
      "................",
      ".....kkkkk......",
      "....kmmlmmk.....",
      "...kmmmmmMMk....",
      "...kMmmmmmMk.kk.",
      "....kkMMMMk.klmk",
      "......kkkk..kMMk",
      ".............kk.",
      "................",
      "................",
      "................",
      "................",
      "................"
    ] },
  { "id": "core.sprite.item.meat", "kind": "sprite", "size": 16, "palette": {"k": "#1b1f24", "m": "$main", "M": "$main-", "l": "$main+", "w": "#f4f1e8"},
    "rows": [
      "................",
      "................",
      "................",
      ".....kkkkkk.....",
      "....kmmmmmmk....",
      "...kmmlllmmmk...",
      "...kmllwllmmk...",
      "...kmmlllmmMk...",
      "....kmmmmmMk....",
      ".....kkMMMk.....",
      ".......kkk......",
      "................",
      "................",
      "................",
      "................",
      "................"
    ] },
  { "id": "core.sprite.item.meal", "kind": "sprite", "size": 16, "palette": {"k": "#1b1f24", "m": "$main", "l": "$main+", "w": "#f4f1e8", "t": "#e8e2d0"},
    "rows": [
      "................",
      "................",
      "................",
      "................",
      ".....k.k.k......",
      "....kmmllmmk....",
      "...kmmlmmmlmk...",
      "..kkkkkkkkkkkk..",
      "..ktwwwwwwwwtk..",
      "...kttttttttk...",
      "....kkkkkkkk....",
      "................",
      "................",
      "................",
      "................",
      "................"
    ] },
  { "id": "core.sprite.item.leather", "kind": "sprite", "size": 16, "palette": {"k": "#1b1f24", "m": "$main", "M": "$main-"},
    "rows": [
      "................",
      "................",
      "..kk.......kk...",
      "..kmk.....kmk...",
      "...kmkkkkkmk....",
      "...kmmmmmmmk....",
      "..kmmmMmmmmmk...",
      "..kmmmmmmMmmk...",
      "..kmMmmmmmmmk...",
      "...kmmmmmmmk....",
      "..kmk.kkk.kmk...",
      "..kk.......kk...",
      "................",
      "................",
      "................",
      "................"
    ] },
  { "id": "core.sprite.item.cloth", "kind": "sprite", "size": 16, "palette": {"k": "#1b1f24", "m": "$main", "M": "$main-", "l": "$main+"},
    "rows": [
      "................",
      "................",
      "................",
      "..kkkkkkkkkkkk..",
      ".kllllllllllllk.",
      ".kmmmmmmmmmmmmk.",
      ".kMMMMMMMMMMMMk.",
      ".kmmmmmmmmmmmmk.",
      ".kllllllllllllk.",
      "..kkkkkkkkkkkk..",
      "....kmmk........",
      ".....kMk........",
      "......kk........",
      "................",
      "................",
      "................"
    ] }
]
